Movie,LeadStudio,RottenTomatoes,AudienceScore,Story,Genre,TheatersOpenWeek,OpeningWeekend,BOAvgOpenWeekend,DomesticGross,ForeignGross,WorldGross,Budget,Profitability,OpenProfit,Year
Over Her Dead Body,New Line,15,47,Love,Comedy,,4.03,,7.56,13.89,21.46,10,214.57,40.3,2008
Avatar,Fox,83,92,Metamorphosis,Action,3452,77,22313,760.5,2021,2781.5,237,1173.63,32.49,2009
Transformers: Revenge of the Fallen,Paramount,20,76,Revenge,Action,4234,109,25736,402.1,434.2,836.3,210,398.24,51.9,2009
Harry Potter and the Half-Blood Prince,Warner Bros,83,75,Quest,Adventure,4325,77.8,17997,302,632,934,250,373.6,31.12,2009
The Twilight Saga: New Moon,Summit,27,78,Love,Drama,4024,142.8,35497,296.62,413.2,709.82,50,1419.64,285.6,2009
